{
  "source": "Quarterback Immobilien Arena Leipzig",
  "scraped_at": "2025-12-17T00:45:05.825Z",
  "events": [
    {
      "title": "Holiday on Ice",
      "date": "Donnerstag, 18.12.2025",
      "startDate": "2025-12-18",
      "endDate": "2025-12-18",
      "location": "Quarterback Immobilien Arena Leipzig",
      "description": null,
      "image": "/fileadmin/files/_processed_/2/5/csm_KV_clean_1080x1080_1zu1_116d71db37.png",
      "link": "https://www.quarterback-immobilien-arena.de/events-tickets/eventdetail/event/holiday-on-ice/793",
      "tags": []
    },
    {
      "title": "Holiday on Ice",
      "date": "Freitag, 19.12.2025",
      "startDate": "2025-12-19",
      "endDate": "2025-12-19",
      "location": "Quarterback Immobilien Arena Leipzig",
      "description": null,
      "image": "/fileadmin/files/_processed_/2/5/csm_KV_clean_1080x1080_1zu1_116d71db37.png",
      "link": "https://www.quarterback-immobilien-arena.de/events-tickets/eventdetail/event/holiday-on-ice/794",
      "tags": []
    },
    {
      "title": "Holiday on Ice",
      "date": "Freitag, 19.12.2025",
      "startDate": "2025-12-19",
      "endDate": "2025-12-19",
      "location": "Quarterback Immobilien Arena Leipzig",
      "description": null,
      "image": "/fileadmin/files/_processed_/2/5/csm_KV_clean_1080x1080_1zu1_116d71db37.png",
      "link": "https://www.quarterback-immobilien-arena.de/events-tickets/eventdetail/event/holiday-on-ice/795",
      "tags": []
    },
    {
      "title": "Holiday on Ice",
      "date": "Samstag, 20.12.2025",
      "startDate": "2025-12-20",
      "endDate": "2025-12-20",
      "location": "Quarterback Immobilien Arena Leipzig",
      "description": null,
      "image": "/fileadmin/files/_processed_/2/5/csm_KV_clean_1080x1080_1zu1_116d71db37.png",
      "link": "https://www.quarterback-immobilien-arena.de/events-tickets/eventdetail/event/holiday-on-ice/796",
      "tags": []
    },
    {
      "title": "Holiday on Ice",
      "date": "Samstag, 20.12.2025",
      "startDate": "2025-12-20",
      "endDate": "2025-12-20",
      "location": "Quarterback Immobilien Arena Leipzig",
      "description": null,
      "image": "/fileadmin/files/_processed_/2/5/csm_KV_clean_1080x1080_1zu1_116d71db37.png",
      "link": "https://www.quarterback-immobilien-arena.de/events-tickets/eventdetail/event/holiday-on-ice/797",
      "tags": []
    },
    {
      "title": "Holiday on Ice",
      "date": "Samstag, 20.12.2025",
      "startDate": "2025-12-20",
      "endDate": "2025-12-20",
      "location": "Quarterback Immobilien Arena Leipzig",
      "description": null,
      "image": "/fileadmin/files/_processed_/2/5/csm_KV_clean_1080x1080_1zu1_116d71db37.png",
      "link": "https://www.quarterback-immobilien-arena.de/events-tickets/eventdetail/event/holiday-on-ice/798",
      "tags": []
    },
    {
      "title": "Holiday on Ice",
      "date": "Sonntag, 21.12.2025",
      "startDate": "2025-12-21",
      "endDate": "2025-12-21",
      "location": "Quarterback Immobilien Arena Leipzig",
      "description": null,
      "image": "/fileadmin/files/_processed_/2/5/csm_KV_clean_1080x1080_1zu1_116d71db37.png",
      "link": "https://www.quarterback-immobilien-arena.de/events-tickets/eventdetail/event/holiday-on-ice/799",
      "tags": []
    },
    {
      "title": "Holiday on Ice",
      "date": "Sonntag, 21.12.2025",
      "startDate": "2025-12-21",
      "endDate": "2025-12-21",
      "location": "Quarterback Immobilien Arena Leipzig",
      "description": null,
      "image": "/fileadmin/files/_processed_/2/5/csm_KV_clean_1080x1080_1zu1_116d71db37.png",
      "link": "https://www.quarterback-immobilien-arena.de/events-tickets/eventdetail/event/holiday-on-ice/800",
      "tags": []
    },
    {
      "title": "Holiday on Ice",
      "date": "Montag, 22.12.2025",
      "startDate": "2025-12-22",
      "endDate": "2025-12-22",
      "location": "Quarterback Immobilien Arena Leipzig",
      "description": null,
      "image": "/fileadmin/files/_processed_/2/5/csm_KV_clean_1080x1080_1zu1_116d71db37.png",
      "link": "https://www.quarterback-immobilien-arena.de/events-tickets/eventdetail/event/holiday-on-ice/961",
      "tags": []
    },
    {
      "title": "Syntainics MBC vs. Niners Chemnitz",
      "date": "Freitag, 26.12.2025",
      "startDate": "2025-12-26",
      "endDate": "2025-12-26",
      "location": "Quarterback Immobilien Arena Leipzig",
      "description": null,
      "image": "/fileadmin/files/user_upload/veranstaltungen/Konzert_Show/2025-12-26_MBC_Niners/20190506_MBC_Syntainics_Logos_RGB_BLUE.png",
      "link": "https://www.quarterback-immobilien-arena.de/events-tickets/eventdetail/event/syntainics-mbc-vs-niners-chemnitz/999",
      "tags": []
    },
    {
      "title": "SC DHfK - Rhein Neckar Löwen",
      "date": "Samstag, 27.12.2025",
      "startDate": "2025-12-27",
      "endDate": "2025-12-27",
      "location": "Quarterback Immobilien Arena Leipzig",
      "description": null,
      "image": "/fileadmin/files/_processed_/9/0/csm_09_4zu3_RNL_5fa039e608.png",
      "link": "https://www.quarterback-immobilien-arena.de/events-tickets/eventdetail/event/sc-dhfk-mt-melsungen/850",
      "tags": []
    },
    {
      "title": "Cavalluna",
      "date": "Samstag, 03.01.2026",
      "startDate": "2026-01-03",
      "endDate": "2026-01-03",
      "location": "Quarterback Immobilien Arena Leipzig",
      "description": null,
      "image": "/fileadmin/files/_processed_/0/5/csm_CAVA06_TZA_quer_ARTWORK_389afdd1e7.jpg",
      "link": "https://www.quarterback-immobilien-arena.de/events-tickets/eventdetail/event/cavalluna/802",
      "tags": []
    },
    {
      "title": "Cavalluna",
      "date": "Samstag, 03.01.2026",
      "startDate": "2026-01-03",
      "endDate": "2026-01-03",
      "location": "Quarterback Immobilien Arena Leipzig",
      "description": null,
      "image": "/fileadmin/files/_processed_/0/5/csm_CAVA06_TZA_quer_ARTWORK_389afdd1e7.jpg",
      "link": "https://www.quarterback-immobilien-arena.de/events-tickets/eventdetail/event/cavalluna/804",
      "tags": []
    },
    {
      "title": "Cavalluna",
      "date": "Sonntag, 04.01.2026",
      "startDate": "2026-01-04",
      "endDate": "2026-01-04",
      "location": "Quarterback Immobilien Arena Leipzig",
      "description": null,
      "image": "/fileadmin/files/_processed_/0/5/csm_CAVA06_TZA_quer_ARTWORK_389afdd1e7.jpg",
      "link": "https://www.quarterback-immobilien-arena.de/events-tickets/eventdetail/event/cavalluna/803",
      "tags": []
    },
    {
      "title": "WWE Live",
      "date": "Donnerstag, 08.01.2026",
      "startDate": "2026-01-08",
      "endDate": "2026-01-08",
      "location": "Quarterback Immobilien Arena Leipzig",
      "description": null,
      "image": "/fileadmin/files/_processed_/3/6/csm_WWE2026_Portrait_00_7e39f8d712.jpg",
      "link": "https://www.quarterback-immobilien-arena.de/events-tickets/eventdetail/event/wwe-live/967",
      "tags": []
    },
    {
      "title": "Max Raabe & Palast Orchester",
      "date": "Samstag, 10.01.2026",
      "startDate": "2026-01-10",
      "endDate": "2026-01-10",
      "location": "Quarterback Immobilien Arena Leipzig",
      "description": null,
      "image": "/fileadmin/files/_processed_/5/2/csm_Pressefoto_MAX_RAABE__PALAST_ORCHESTER_2__c__Gregor_Hohenberg_01_b61922fb06.jpg",
      "link": "https://www.quarterback-immobilien-arena.de/events-tickets/eventdetail/event/max-raabe-palast-orchester/885",
      "tags": []
    },
    {
      "title": "Feuerwerk der Turnkunst",
      "date": "Dienstag, 13.01.2026",
      "startDate": "2026-01-13",
      "endDate": "2026-01-13",
      "location": "Quarterback Immobilien Arena Leipzig",
      "description": null,
      "image": "/fileadmin/files/_processed_/7/3/csm_VIVA_Tournee_856x926_px_e7e4f4c9f0.jpg",
      "link": "https://www.quarterback-immobilien-arena.de/events-tickets/eventdetail/event/feuerwerk-der-turnkunst/895",
      "tags": []
    },
    {
      "title": "Feuerwerk der Turnkunst",
      "date": "Mittwoch, 14.01.2026",
      "startDate": "2026-01-14",
      "endDate": "2026-01-14",
      "location": "Quarterback Immobilien Arena Leipzig",
      "description": null,
      "image": "/fileadmin/files/_processed_/7/3/csm_VIVA_Tournee_856x926_px_e7e4f4c9f0.jpg",
      "link": "https://www.quarterback-immobilien-arena.de/events-tickets/eventdetail/event/feuerwerk-der-turnkunst/896",
      "tags": []
    },
    {
      "title": "Bushido",
      "date": "Freitag, 16.01.2026",
      "startDate": "2026-01-16",
      "endDate": "2026-01-16",
      "location": "Quarterback Immobilien Arena Leipzig",
      "description": null,
      "image": "/fileadmin/files/_processed_/4/b/csm_240321-AS-BUSHIDO_013-Bild_28882665ab.jpg",
      "link": "https://www.quarterback-immobilien-arena.de/events-tickets/eventdetail/event/bushido/843",
      "tags": []
    },
    {
      "title": "Ralf Schmitz",
      "date": "Samstag, 17.01.2026",
      "startDate": "2026-01-17",
      "endDate": "2026-01-17",
      "location": "Quarterback Immobilien Arena Leipzig",
      "description": null,
      "image": "/fileadmin/files/_processed_/5/1/csm_Pressefoto_RALF_SCHMITZ_Schmitzfindigkeiten__c__Robert_Recker_d7279cf3a9.jpg",
      "link": "https://www.quarterback-immobilien-arena.de/events-tickets/eventdetail/event/ralf-schmitz/905",
      "tags": []
    },
    {
      "title": "Xavier Naidoo",
      "date": "Sonntag, 18.01.2026",
      "startDate": "2026-01-18",
      "endDate": "2026-01-18",
      "location": "Quarterback Immobilien Arena Leipzig",
      "description": null,
      "image": "/fileadmin/files/_processed_/e/c/csm_Xavier_Naidoo_Pressefoto_1klein_cd07511a92.jpg",
      "link": "https://www.quarterback-immobilien-arena.de/events-tickets/eventdetail/event/xavier-naidoo/957",
      "tags": []
    },
    {
      "title": "Michelle",
      "date": "Freitag, 23.01.2026",
      "startDate": "2026-01-23",
      "endDate": "2026-01-23",
      "location": "Quarterback Immobilien Arena Leipzig",
      "description": null,
      "image": "/fileadmin/files/_processed_/9/1/csm_Michelle_26_Gold-sc_highl_art_square_a218673362.jpg",
      "link": "https://www.quarterback-immobilien-arena.de/events-tickets/eventdetail/event/michelle/838",
      "tags": []
    },
    {
      "title": "Sachsen Darts Gala",
      "date": "Samstag, 24.01.2026",
      "startDate": "2026-01-24",
      "endDate": "2026-01-24",
      "location": "Quarterback Immobilien Arena Leipzig",
      "description": null,
      "image": "/fileadmin/files/_processed_/6/b/csm_DARTS-SACHSEN_SM_1920x1920_4Spieler-FINAL_7caf443a0a.jpg",
      "link": "https://www.quarterback-immobilien-arena.de/events-tickets/eventdetail/event/sachsen-darts-gala/982",
      "tags": []
    },
    {
      "title": "SC DHfK - Bergischer HC",
      "date": "Sonntag, 01.03.2026",
      "startDate": "2026-03-01",
      "endDate": "2026-03-01",
      "location": "Quarterback Immobilien Arena Leipzig",
      "description": null,
      "image": "/fileadmin/files/_processed_/7/4/csm_2024-08-05_vorlaeufiges_Bild_8545c1692b.jpg",
      "link": "https://www.quarterback-immobilien-arena.de/events-tickets/eventdetail/event/sc-dhfk-bergischer-hc/564",
      "tags": []
    },
    {
      "title": "Powerwolf",
      "date": "Dienstag, 03.03.2026",
      "startDate": "2026-03-03",
      "endDate": "2026-03-03",
      "location": "Quarterback Immobilien Arena Leipzig",
      "description": null,
      "image": "/fileadmin/files/_processed_/d/d/csm_Grafik_6aa3f69c63.png",
      "link": "https://www.quarterback-immobilien-arena.de/events-tickets/eventdetail/event/powerwolf/952",
      "tags": []
    },
    {
      "title": "Sean Paul",
      "date": "Donnerstag, 05.03.2026",
      "startDate": "2026-03-05",
      "endDate": "2026-03-05",
      "location": "Quarterback Immobilien Arena Leipzig",
      "description": null,
      "image": "/fileadmin/files/_processed_/5/1/csm_PRESS_PICTURE_2_CREDIT_SEAN_PAUL_web_9c8dfe048d.jpg",
      "link": "https://www.quarterback-immobilien-arena.de/events-tickets/eventdetail/event/sean-paul/995",
      "tags": []
    },
    {
      "title": "Ben Zucker",
      "date": "Samstag, 07.03.2026",
      "startDate": "2026-03-07",
      "endDate": "2026-03-07",
      "location": "Quarterback Immobilien Arena Leipzig",
      "description": null,
      "image": "/fileadmin/files/_processed_/a/6/csm_BenZucker_26_Kaempferherz-artwork-grafik_6eaa65c21d.jpg",
      "link": "https://www.quarterback-immobilien-arena.de/events-tickets/eventdetail/event/ben-zucker/888",
      "tags": []
    },
    {
      "title": "Bushido",
      "date": "Dienstag, 10.03.2026",
      "startDate": "2026-03-10",
      "endDate": "2026-03-10",
      "location": "Quarterback Immobilien Arena Leipzig",
      "description": null,
      "image": "/fileadmin/files/_processed_/4/b/csm_240321-AS-BUSHIDO_013-Bild_28882665ab.jpg",
      "link": "https://www.quarterback-immobilien-arena.de/events-tickets/eventdetail/event/bushido/944",
      "tags": []
    },
    {
      "title": "Felix Lobrecht",
      "date": "Donnerstag, 12.03.2026",
      "startDate": "2026-03-12",
      "endDate": "2026-03-12",
      "location": "Quarterback Immobilien Arena Leipzig",
      "description": null,
      "image": "/fileadmin/files/_processed_/c/d/csm_FL_SellOut_1080x1080_8__c__Marvin_Ruppert_8a47f890ca.jpg",
      "link": "https://www.quarterback-immobilien-arena.de/events-tickets/eventdetail/event/felix-lobrecht/860",
      "tags": []
    },
    {
      "title": "Felix Lobrecht",
      "date": "Freitag, 13.03.2026",
      "startDate": "2026-03-13",
      "endDate": "2026-03-13",
      "location": "Quarterback Immobilien Arena Leipzig",
      "description": null,
      "image": "/fileadmin/files/_processed_/c/d/csm_FL_SellOut_1080x1080_8__c__Marvin_Ruppert_8a47f890ca.jpg",
      "link": "https://www.quarterback-immobilien-arena.de/events-tickets/eventdetail/event/felix-lobrecht/903",
      "tags": []
    },
    {
      "title": "Musikparade 2026",
      "date": "Samstag, 14.03.2026",
      "startDate": "2026-03-14",
      "endDate": "2026-03-14",
      "location": "Quarterback Immobilien Arena Leipzig",
      "description": null,
      "image": "/fileadmin/files/_processed_/0/2/csm_2025-02-24_aktuelles_Bild_a676b7b72c.jpg",
      "link": "https://www.quarterback-immobilien-arena.de/events-tickets/eventdetail/event/musikparade-2026/902",
      "tags": []
    },
    {
      "title": "Sarah Connor",
      "date": "Mittwoch, 18.03.2026",
      "startDate": "2026-03-18",
      "endDate": "2026-03-18",
      "location": "Quarterback Immobilien Arena Leipzig",
      "description": null,
      "image": "/fileadmin/files/_processed_/4/7/csm_SarahConnor_2026_Artwork_1x1_87af9910cf.jpg",
      "link": "https://www.quarterback-immobilien-arena.de/events-tickets/eventdetail/event/sarah-connor/883",
      "tags": []
    },
    {
      "title": "The Rock Symphony Orchestra",
      "date": "Donnerstag, 19.03.2026",
      "startDate": "2026-03-19",
      "endDate": "2026-03-19",
      "location": "Quarterback Immobilien Arena Leipzig",
      "description": null,
      "image": "/fileadmin/files/_processed_/f/b/csm_TheRSO_photo05_0ea472bfe5.jpg",
      "link": "https://www.quarterback-immobilien-arena.de/events-tickets/eventdetail/event/the-rock-symphony-orchestra/1000",
      "tags": []
    },
    {
      "title": "Thomas Anders sings Modern Talking",
      "date": "Mittwoch, 25.03.2026",
      "startDate": "2026-03-25",
      "endDate": "2026-03-25",
      "location": "Quarterback Immobilien Arena Leipzig",
      "description": null,
      "image": "/fileadmin/files/_processed_/4/8/csm_ThomasAnders_singsMT_quadr_Credit__C__Chartwards_GmbH_be3e5a1124.jpg",
      "link": "https://www.quarterback-immobilien-arena.de/events-tickets/eventdetail/event/thomas-anders-sind-modern-talking/916",
      "tags": []
    },
    {
      "title": "Alex Christensen & The Berlin Orchestra",
      "date": "Donnerstag, 26.03.2026",
      "startDate": "2026-03-26",
      "endDate": "2026-03-26",
      "location": "Quarterback Immobilien Arena Leipzig",
      "description": null,
      "image": "/fileadmin/files/_processed_/5/5/csm_2025-11-03_Instagram_Post02_c3536c26cd.jpg",
      "link": "https://www.quarterback-immobilien-arena.de/events-tickets/eventdetail/event/alex-christensen-the-berlin-orchestra/863",
      "tags": []
    },
    {
      "title": "Clueso",
      "date": "Freitag, 27.03.2026",
      "startDate": "2026-03-27",
      "endDate": "2026-03-27",
      "location": "Quarterback Immobilien Arena Leipzig",
      "description": null,
      "image": "/fileadmin/files/_processed_/f/f/csm_FB_Bild_ec2b5b541b.jpg",
      "link": "https://www.quarterback-immobilien-arena.de/events-tickets/eventdetail/event/clueso/962",
      "tags": []
    },
    {
      "title": "Paul Panzer",
      "date": "Samstag, 28.03.2026",
      "startDate": "2026-03-28",
      "endDate": "2026-03-28",
      "location": "Quarterback Immobilien Arena Leipzig",
      "description": null,
      "image": "/fileadmin/files/_processed_/a/3/csm_Pressefoto_PAUL_PANZER_SCHOENE_NEUE_WELT_...Welcome_To_Hell__c__publiks_2023_f0dc81f0eb.jpg",
      "link": "https://www.quarterback-immobilien-arena.de/events-tickets/eventdetail/event/paul-panzer/915",
      "tags": []
    },
    {
      "title": "Beat it!",
      "date": "Dienstag, 31.03.2026",
      "startDate": "2026-03-31",
      "endDate": "2026-03-31",
      "location": "Quarterback Immobilien Arena Leipzig",
      "description": null,
      "image": "/fileadmin/files/_processed_/5/8/csm_Anzeige_BEAT_IT45_x_45_mm_0f6e36ff82.jpg",
      "link": "https://www.quarterback-immobilien-arena.de/events-tickets/eventdetail/event/beat-it/945",
      "tags": []
    },
    {
      "title": "7vs.Wild",
      "date": "Donnerstag, 02.04.2026",
      "startDate": "2026-04-02",
      "endDate": "2026-04-02",
      "location": "Quarterback Immobilien Arena Leipzig",
      "description": null,
      "image": "/fileadmin/files/_processed_/5/d/csm_7vsWild2025_Cast-Otto-Sabrina-Roofless_Post_ohne_eventim_0bd4ca4ba5.jpg",
      "link": "https://www.quarterback-immobilien-arena.de/events-tickets/eventdetail/event/7vswild/862",
      "tags": []
    },
    {
      "title": "Howard Carpendale",
      "date": "Mittwoch, 08.04.2026",
      "startDate": "2026-04-08",
      "endDate": "2026-04-08",
      "location": "Quarterback Immobilien Arena Leipzig",
      "description": null,
      "image": "/fileadmin/files/_processed_/c/d/csm_HCarpendale_26_Abschied_Gold_Schwarz-sc_highl_art_square_67d8437e78.jpg",
      "link": "https://www.quarterback-immobilien-arena.de/events-tickets/eventdetail/event/howard-carpendale-1/864",
      "tags": []
    },
    {
      "title": "SC DHfK - FA! Göppingen",
      "date": "Donnerstag, 09.04.2026",
      "startDate": "2026-04-09",
      "endDate": "2026-04-09",
      "location": "Quarterback Immobilien Arena Leipzig",
      "description": null,
      "image": "/fileadmin/files/_processed_/7/4/csm_2024-08-05_vorlaeufiges_Bild_ece14e3097.jpg",
      "link": "https://www.quarterback-immobilien-arena.de/events-tickets/eventdetail/event/sc-dhfk-fa-goeppingen/741",
      "tags": []
    },
    {
      "title": "Schlagernacht des Jahres 2026",
      "date": "Samstag, 11.04.2026",
      "startDate": "2026-04-11",
      "endDate": "2026-04-11",
      "location": "Quarterback Immobilien Arena Leipzig",
      "description": null,
      "image": "/fileadmin/files/_processed_/7/1/csm_SNdJ_2026_Herzen_schlagern-sc_highl_art_square_4d234ecd33.jpg",
      "link": "https://www.quarterback-immobilien-arena.de/events-tickets/eventdetail/event/schlagernacht-des-jahres-2026/919",
      "tags": []
    },
    {
      "title": "singOUT",
      "date": "Sonntag, 12.04.2026",
      "startDate": "2026-04-12",
      "endDate": "2026-04-12",
      "location": "Quarterback Immobilien Arena Leipzig",
      "description": null,
      "image": "/fileadmin/files/_processed_/f/5/csm_Pressebild_a267263fc9.jpg",
      "link": "https://www.quarterback-immobilien-arena.de/events-tickets/eventdetail/event/singout/960",
      "tags": []
    },
    {
      "title": "Falco Meets Amadeus",
      "date": "Dienstag, 14.04.2026",
      "startDate": "2026-04-14",
      "endDate": "2026-04-14",
      "location": "Quarterback Immobilien Arena Leipzig",
      "description": null,
      "image": "/fileadmin/files/_processed_/f/d/csm_1080x1080_ca83e319dc.jpg",
      "link": "https://www.quarterback-immobilien-arena.de/events-tickets/eventdetail/event/falco-meets-amadeus/954",
      "tags": []
    },
    {
      "title": "Santiano",
      "date": "Mittwoch, 15.04.2026",
      "startDate": "2026-04-15",
      "endDate": "2026-04-15",
      "location": "Quarterback Immobilien Arena Leipzig",
      "description": null,
      "image": "/fileadmin/files/_processed_/e/d/csm_01_Pressefoto_Santiano_Dabrautsichwaszusammen_DiegrosseArenaTour_Fruehjahr2026_ChrisHeidrich_e1917d1945.jpg",
      "link": "https://www.quarterback-immobilien-arena.de/events-tickets/eventdetail/event/santiano/921",
      "tags": []
    },
    {
      "title": "Mario Barth",
      "date": "Freitag, 17.04.2026",
      "startDate": "2026-04-17",
      "endDate": "2026-04-17",
      "location": "Quarterback Immobilien Arena Leipzig",
      "description": null,
      "image": "/fileadmin/files/_processed_/8/6/csm_Mario_Barth_Maenner_sind_nichts_ohne_die_Frauen-quadrat__c_Mayk_Azzato_2846172d4f.jpg",
      "link": "https://www.quarterback-immobilien-arena.de/events-tickets/eventdetail/event/mario-barth-1/889",
      "tags": []
    },
    {
      "title": "Michael Patrick Kelly",
      "date": "Samstag, 18.04.2026",
      "startDate": "2026-04-18",
      "endDate": "2026-04-18",
      "location": "Quarterback Immobilien Arena Leipzig",
      "description": null,
      "image": "/fileadmin/files/_processed_/0/3/csm_02_Pressebild_MichaelPatrickKelly_Credit_ThomasRabsch_d0a9fd584b.jpg",
      "link": "https://www.quarterback-immobilien-arena.de/events-tickets/eventdetail/event/michael-patrick-kelly/876",
      "tags": []
    },
    {
      "title": "Abbamania",
      "date": "Dienstag, 21.04.2026",
      "startDate": "2026-04-21",
      "endDate": "2026-04-21",
      "location": "Quarterback Immobilien Arena Leipzig",
      "description": null,
      "image": "/fileadmin/files/_processed_/e/6/csm_01_ABBAMANIA-THE-SHOW_Credit_MilanSchmalenbach__1__1aa8a3159f.jpg",
      "link": "https://www.quarterback-immobilien-arena.de/events-tickets/eventdetail/event/abbamania/910",
      "tags": []
    },
    {
      "title": "Ehrlich Brothers",
      "date": "Freitag, 24.04.2026",
      "startDate": "2026-04-24",
      "endDate": "2026-04-24",
      "location": "Quarterback Immobilien Arena Leipzig",
      "description": null,
      "image": "/fileadmin/files/_processed_/d/f/csm_2025-01-17_EB_1_c5ebeeeac7.jpg",
      "link": "https://www.quarterback-immobilien-arena.de/events-tickets/eventdetail/event/ehrlich-brothers-1/986",
      "tags": []
    },
    {
      "title": "Ehrlich Brothers",
      "date": "Samstag, 25.04.2026",
      "startDate": "2026-04-25",
      "endDate": "2026-04-25",
      "location": "Quarterback Immobilien Arena Leipzig",
      "description": null,
      "image": "/fileadmin/files/_processed_/d/f/csm_2025-01-17_EB_1_c5ebeeeac7.jpg",
      "link": "https://www.quarterback-immobilien-arena.de/events-tickets/eventdetail/event/ehrlich-brothers-1/987",
      "tags": []
    },
    {
      "title": "Ehrlich Brothers",
      "date": "Samstag, 25.04.2026",
      "startDate": "2026-04-25",
      "endDate": "2026-04-25",
      "location": "Quarterback Immobilien Arena Leipzig",
      "description": null,
      "image": "/fileadmin/files/_processed_/d/f/csm_2025-01-17_EB_1_c5ebeeeac7.jpg",
      "link": "https://www.quarterback-immobilien-arena.de/events-tickets/eventdetail/event/ehrlich-brothers-1/898",
      "tags": []
    },
    {
      "title": "Ehrlich Brothers",
      "date": "Sonntag, 26.04.2026",
      "startDate": "2026-04-26",
      "endDate": "2026-04-26",
      "location": "Quarterback Immobilien Arena Leipzig",
      "description": null,
      "image": "/fileadmin/files/_processed_/d/f/csm_2025-01-17_EB_1_c5ebeeeac7.jpg",
      "link": "https://www.quarterback-immobilien-arena.de/events-tickets/eventdetail/event/ehrlich-brothers-1/899",
      "tags": []
    },
    {
      "title": "Ehrlich Brothers",
      "date": "Sonntag, 26.04.2026",
      "startDate": "2026-04-26",
      "endDate": "2026-04-26",
      "location": "Quarterback Immobilien Arena Leipzig",
      "description": null,
      "image": "/fileadmin/files/_processed_/d/f/csm_2025-01-17_EB_1_c5ebeeeac7.jpg",
      "link": "https://www.quarterback-immobilien-arena.de/events-tickets/eventdetail/event/ehrlich-brothers-1/900",
      "tags": []
    },
    {
      "title": "Johannes Oerding",
      "date": "Freitag, 01.05.2026",
      "startDate": "2026-05-01",
      "endDate": "2026-05-01",
      "location": "Quarterback Immobilien Arena Leipzig",
      "description": null,
      "image": "/fileadmin/files/_processed_/e/5/csm_JohannesOerding_0348_ThomasLeidig_a75d9e5717.jpg",
      "link": "https://www.quarterback-immobilien-arena.de/events-tickets/eventdetail/event/johannes-oerding/877",
      "tags": []
    },
    {
      "title": "DJ BoBo",
      "date": "Samstag, 02.05.2026",
      "startDate": "2026-05-02",
      "endDate": "2026-05-02",
      "location": "Quarterback Immobilien Arena Leipzig",
      "description": null,
      "image": "/fileadmin/files/_processed_/9/2/csm_FB-Event-Cover-Leipzig_4537d5ef7c.jpg",
      "link": "https://www.quarterback-immobilien-arena.de/events-tickets/eventdetail/event/dj-bobo/884",
      "tags": []
    },
    {
      "title": "DJ BoBo",
      "date": "Sonntag, 03.05.2026",
      "startDate": "2026-05-03",
      "endDate": "2026-05-03",
      "location": "Quarterback Immobilien Arena Leipzig",
      "description": null,
      "image": "/fileadmin/files/_processed_/9/2/csm_FB-Event-Cover-Leipzig_4537d5ef7c.jpg",
      "link": "https://www.quarterback-immobilien-arena.de/events-tickets/eventdetail/event/dj-bobo/969",
      "tags": []
    },
    {
      "title": "Frei.Wild",
      "date": "Donnerstag, 07.05.2026",
      "startDate": "2026-05-07",
      "endDate": "2026-05-07",
      "location": "Quarterback Immobilien Arena Leipzig",
      "description": null,
      "image": "/fileadmin/files/_processed_/4/6/csm_FW_Press_5_5935376fab.jpg",
      "link": "https://www.quarterback-immobilien-arena.de/events-tickets/eventdetail/event/freiwild/946",
      "tags": []
    },
    {
      "title": "Frei.Wild",
      "date": "Freitag, 08.05.2026",
      "startDate": "2026-05-08",
      "endDate": "2026-05-08",
      "location": "Quarterback Immobilien Arena Leipzig",
      "description": null,
      "image": "/fileadmin/files/_processed_/4/6/csm_FW_Press_5_5935376fab.jpg",
      "link": "https://www.quarterback-immobilien-arena.de/events-tickets/eventdetail/event/freiwild/923",
      "tags": []
    },
    {
      "title": "Schiller",
      "date": "Samstag, 09.05.2026",
      "startDate": "2026-05-09",
      "endDate": "2026-05-09",
      "location": "Quarterback Immobilien Arena Leipzig",
      "description": null,
      "image": "/fileadmin/files/_processed_/3/a/csm_10_Pressefoto_SCHILLER_Euphoria_2026_C_Annemone_Taake_6c44769462.jpg",
      "link": "https://www.quarterback-immobilien-arena.de/events-tickets/eventdetail/event/schiller/866",
      "tags": []
    },
    {
      "title": "BOSSE",
      "date": "Freitag, 15.05.2026",
      "startDate": "2026-05-15",
      "endDate": "2026-05-15",
      "location": "Quarterback Immobilien Arena Leipzig",
      "description": null,
      "image": "/fileadmin/files/_processed_/1/6/csm_1._BOSSE_POLAROID_cFELIXAARON_f940b7c7ec.jpg",
      "link": "https://www.quarterback-immobilien-arena.de/events-tickets/eventdetail/event/bosse/947",
      "tags": []
    },
    {
      "title": "One Night Of Taylor",
      "date": "Montag, 18.05.2026",
      "startDate": "2026-05-18",
      "endDate": "2026-05-18",
      "location": "Quarterback Immobilien Arena Leipzig",
      "description": null,
      "image": "/fileadmin/files/_processed_/6/2/csm_02_Pressefoto_ONOT_TheTaylorSwiftTributeByXenna_Tour2026_c_RED_Entertainment_7d361d4586.jpg",
      "link": "https://www.quarterback-immobilien-arena.de/events-tickets/eventdetail/event/one-night-of-taylor/959",
      "tags": []
    },
    {
      "title": "Night of the Jumps",
      "date": "Samstag, 23.05.2026",
      "startDate": "2026-05-23",
      "endDate": "2026-05-23",
      "location": "Quarterback Immobilien Arena Leipzig",
      "description": null,
      "image": "/fileadmin/files/_processed_/1/d/csm_NOTJ_MGNFY_SI_L_b7fec7d344.jpg",
      "link": "https://www.quarterback-immobilien-arena.de/events-tickets/eventdetail/event/night-of-the-jumps/972",
      "tags": []
    },
    {
      "title": "André Rieu",
      "date": "Donnerstag, 28.05.2026",
      "startDate": "2026-05-28",
      "endDate": "2026-05-28",
      "location": "Quarterback Immobilien Arena Leipzig",
      "description": null,
      "image": "/fileadmin/files/_processed_/e/0/csm_AndreRieu_Leipzig_1024x768px_716cca588b.jpg",
      "link": "https://www.quarterback-immobilien-arena.de/events-tickets/eventdetail/event/andre-rieu-1/909",
      "tags": []
    },
    {
      "title": "Der Herr der Ringe",
      "date": "Freitag, 29.05.2026",
      "startDate": "2026-05-29",
      "endDate": "2026-05-29",
      "location": "Quarterback Immobilien Arena Leipzig",
      "description": null,
      "image": "/fileadmin/files/_processed_/f/6/csm_Der-Herr-der-Ringe-Die-Gefa__hrten-In-Concert-16x9_75a9851d11.jpg",
      "link": "https://www.quarterback-immobilien-arena.de/events-tickets/eventdetail/event/der-herr-der-ringe/956",
      "tags": []
    },
    {
      "title": "Calum Scott",
      "date": "Mittwoch, 03.06.2026",
      "startDate": "2026-06-03",
      "endDate": "2026-06-03",
      "location": "Quarterback Immobilien Arena Leipzig",
      "description": null,
      "image": "/fileadmin/files/_processed_/b/3/csm_Pressshot20251_Calum_Scott_Credit_Tom_Cockram_e98a8607ac.jpg",
      "link": "https://www.quarterback-immobilien-arena.de/events-tickets/eventdetail/event/calum-scott/1003",
      "tags": []
    },
    {
      "title": "Bad Omens",
      "date": "Montag, 08.06.2026",
      "startDate": "2026-06-08",
      "endDate": "2026-06-08",
      "location": "Quarterback Immobilien Arena Leipzig",
      "description": null,
      "image": "/fileadmin/files/_processed_/9/b/csm_Omens_Digital_SOURCE_CAA_web_58c1fdfc09.jpg",
      "link": "https://www.quarterback-immobilien-arena.de/events-tickets/eventdetail/event/bad-omens/996",
      "tags": []
    },
    {
      "title": "Zucchero",
      "date": "Dienstag, 09.06.2026",
      "startDate": "2026-06-09",
      "endDate": "2026-06-09",
      "location": "Quarterback Immobilien Arena Leipzig",
      "description": null,
      "image": "/fileadmin/files/_processed_/f/3/csm_2024-12-19_vorlaeufiges_Bild_4a6a23ba94.png",
      "link": "https://www.quarterback-immobilien-arena.de/events-tickets/eventdetail/event/zucchero/893",
      "tags": []
    },
    {
      "title": "Böhse Onkelz",
      "date": "Freitag, 12.06.2026",
      "startDate": "2026-06-12",
      "endDate": "2026-06-12",
      "location": "Quarterback Immobilien Arena Leipzig",
      "description": null,
      "image": "/fileadmin/files/_processed_/a/6/csm_BO26-News-Posting-Tour-1920x1080_9e34bc6805.jpg",
      "link": "https://www.quarterback-immobilien-arena.de/events-tickets/eventdetail/event/boehse-onkelz/1002",
      "tags": []
    },
    {
      "title": "Böhse Onkelz",
      "date": "Samstag, 13.06.2026",
      "startDate": "2026-06-13",
      "endDate": "2026-06-13",
      "location": "Quarterback Immobilien Arena Leipzig",
      "description": null,
      "image": "/fileadmin/files/_processed_/a/6/csm_BO26-News-Posting-Tour-1920x1080_9e34bc6805.jpg",
      "link": "https://www.quarterback-immobilien-arena.de/events-tickets/eventdetail/event/boehse-onkelz/1001",
      "tags": []
    },
    {
      "title": "AnnenMayKantereit",
      "date": "Donnerstag, 10.09.2026",
      "startDate": "2026-09-10",
      "endDate": "2026-09-10",
      "location": "Quarterback Immobilien Arena Leipzig",
      "description": null,
      "image": "/fileadmin/files/_processed_/f/1/csm_AnnenMayKantereit_PressPic2025-1_quer_Martin_Lamberty_Freigabe_c5d2d23a0d.jpg",
      "link": "https://www.quarterback-immobilien-arena.de/events-tickets/eventdetail/event/annenmaykantereit/958",
      "tags": []
    },
    {
      "title": "AnnenMayKantereit",
      "date": "Freitag, 11.09.2026",
      "startDate": "2026-09-11",
      "endDate": "2026-09-11",
      "location": "Quarterback Immobilien Arena Leipzig",
      "description": null,
      "image": "/fileadmin/files/_processed_/f/1/csm_AnnenMayKantereit_PressPic2025-1_quer_Martin_Lamberty_Freigabe_c5d2d23a0d.jpg",
      "link": "https://www.quarterback-immobilien-arena.de/events-tickets/eventdetail/event/annenmaykantereit/953",
      "tags": []
    },
    {
      "title": "Das Größte Malle Festival",
      "date": "Samstag, 26.09.2026",
      "startDate": "2026-09-26",
      "endDate": "2026-09-26",
      "location": "Quarterback Immobilien Arena Leipzig",
      "description": null,
      "image": "/fileadmin/files/_processed_/1/3/csm_1744624611049_4fac7db468.jpg",
      "link": "https://www.quarterback-immobilien-arena.de/events-tickets/eventdetail/event/malle-festival/920",
      "tags": []
    },
    {
      "title": "NENA",
      "date": "Donnerstag, 01.10.2026",
      "startDate": "2026-10-01",
      "endDate": "2026-10-01",
      "location": "Quarterback Immobilien Arena Leipzig",
      "description": null,
      "image": "/fileadmin/files/_processed_/d/0/csm_Nena_Live_4_copyright_Sarah_Rechbauer___Laugh___Peas_Entertainment___Lifestyle_GmbH_e6221ce0b5.jpg",
      "link": "https://www.quarterback-immobilien-arena.de/events-tickets/eventdetail/event/nena/950",
      "tags": []
    },
    {
      "title": "Chris Norman",
      "date": "Freitag, 09.10.2026",
      "startDate": "2026-10-09",
      "endDate": "2026-10-09",
      "location": "Quarterback Immobilien Arena Leipzig",
      "description": null,
      "image": "/fileadmin/files/_processed_/c/e/csm_Chris_Norman__c_Marcel_Brell_5e7ff815cd.jpg",
      "link": "https://www.quarterback-immobilien-arena.de/events-tickets/eventdetail/event/chris-norman/978",
      "tags": []
    },
    {
      "title": "Tutty Tran",
      "date": "Sonntag, 11.10.2026",
      "startDate": "2026-10-11",
      "endDate": "2026-10-11",
      "location": "Quarterback Immobilien Arena Leipzig",
      "description": null,
      "image": "/fileadmin/files/_processed_/0/0/csm_Pressefoto_TUTTY_TRAN_1__c__Marvin_Ruppert_96198bf38a.jpg",
      "link": "https://www.quarterback-immobilien-arena.de/events-tickets/eventdetail/event/tutty-tran/973",
      "tags": []
    },
    {
      "title": "Die Nervigen",
      "date": "Mittwoch, 14.10.2026",
      "startDate": "2026-10-14",
      "endDate": "2026-10-14",
      "location": "Quarterback Immobilien Arena Leipzig",
      "description": null,
      "image": "/fileadmin/files/_processed_/6/4/csm_DieNervigen__c_Die_Nervigen_3e367989fd.jpg",
      "link": "https://www.quarterback-immobilien-arena.de/events-tickets/eventdetail/event/die-nervigen/970",
      "tags": []
    },
    {
      "title": "Beatrice Egli",
      "date": "Samstag, 17.10.2026",
      "startDate": "2026-10-17",
      "endDate": "2026-10-17",
      "location": "Quarterback Immobilien Arena Leipzig",
      "description": null,
      "image": "/fileadmin/files/_processed_/8/e/csm_2025-04-07_vorlaeufiges_Bild-eventim.jpg_cbe44d0e7f.jpeg",
      "link": "https://www.quarterback-immobilien-arena.de/events-tickets/eventdetail/event/beatrice-egli/917",
      "tags": []
    },
    {
      "title": "Marteria",
      "date": "Sonntag, 18.10.2026",
      "startDate": "2026-10-18",
      "endDate": "2026-10-18",
      "location": "Quarterback Immobilien Arena Leipzig",
      "description": null,
      "image": "/fileadmin/files/_processed_/a/e/csm_bastianbochinski_marteria_2025_berlin-61_web_1e9d781ac7.jpg",
      "link": "https://www.quarterback-immobilien-arena.de/events-tickets/eventdetail/event/marteria/966",
      "tags": []
    },
    {
      "title": "Wahnsinn!",
      "date": "Freitag, 23.10.2026",
      "startDate": "2026-10-23",
      "endDate": "2026-10-23",
      "location": "Quarterback Immobilien Arena Leipzig",
      "description": null,
      "image": "/fileadmin/files/_processed_/5/e/csm_Wahnsinn26_Post_1080x1080_847a632634.jpg",
      "link": "https://www.quarterback-immobilien-arena.de/events-tickets/eventdetail/event/wahnsinn-die-show-2026/901",
      "tags": []
    },
    {
      "title": "The World of Hans Zimmer - The Original curated by Hans Zimmer",
      "date": "Mittwoch, 28.10.2026",
      "startDate": "2026-10-28",
      "endDate": "2026-10-28",
      "location": "Quarterback Immobilien Arena Leipzig",
      "description": null,
      "image": "/fileadmin/files/_processed_/9/1/csm_WOHZ_OpusKlassik2025_d81ef8a793.jpeg",
      "link": "https://www.quarterback-immobilien-arena.de/events-tickets/eventdetail/event/the-world-of-hans-zimmer-the-original-curated-by-hans-zimmer/911",
      "tags": []
    },
    {
      "title": "Amon Amarth",
      "date": "Freitag, 30.10.2026",
      "startDate": "2026-10-30",
      "endDate": "2026-10-30",
      "location": "Quarterback Immobilien Arena Leipzig",
      "description": null,
      "image": "/fileadmin/files/_processed_/7/b/csm_Amon_Amarth_blue_screen_half_fig_horizontal_A_Final_Photo_by_Tomas_Giden_1c454e367d.jpg",
      "link": "https://www.quarterback-immobilien-arena.de/events-tickets/eventdetail/event/amon-amarth/998",
      "tags": []
    },
    {
      "title": "Deep Purple",
      "date": "Samstag, 31.10.2026",
      "startDate": "2026-10-31",
      "endDate": "2026-10-31",
      "location": "Quarterback Immobilien Arena Leipzig",
      "description": null,
      "image": "/fileadmin/files/_processed_/0/2/csm_Pressebild__c_MAWI_Concert_web_7450c0a7ac.jpg",
      "link": "https://www.quarterback-immobilien-arena.de/events-tickets/eventdetail/event/deep-purple/994",
      "tags": []
    },
    {
      "title": "90s Super Show",
      "date": "Samstag, 07.11.2026",
      "startDate": "2026-11-07",
      "endDate": "2026-11-07",
      "location": "Quarterback Immobilien Arena Leipzig",
      "description": null,
      "image": "/fileadmin/files/_processed_/5/c/csm_Instagram_Leipzig_90sSuperShow_Square_6eb40e53aa.jpg",
      "link": "https://www.quarterback-immobilien-arena.de/events-tickets/eventdetail/event/90s-super-show/1007",
      "tags": []
    },
    {
      "title": "Let's Dance",
      "date": "Dienstag, 10.11.2026",
      "startDate": "2026-11-10",
      "endDate": "2026-11-10",
      "location": "Quarterback Immobilien Arena Leipzig",
      "description": null,
      "image": "/fileadmin/files/_processed_/9/1/csm_LetsDance25_Konfetti_Rot-sc_highl_art_portrait_3c802ef983.jpg",
      "link": "https://www.quarterback-immobilien-arena.de/events-tickets/eventdetail/event/lets-dance/983",
      "tags": []
    },
    {
      "title": "Let's Dance",
      "date": "Mittwoch, 11.11.2026",
      "startDate": "2026-11-11",
      "endDate": "2026-11-11",
      "location": "Quarterback Immobilien Arena Leipzig",
      "description": null,
      "image": "/fileadmin/files/_processed_/9/1/csm_LetsDance25_Konfetti_Rot-sc_highl_art_portrait_3c802ef983.jpg",
      "link": "https://www.quarterback-immobilien-arena.de/events-tickets/eventdetail/event/lets-dance/984",
      "tags": []
    },
    {
      "title": "Tokio Hotel",
      "date": "Freitag, 13.11.2026",
      "startDate": "2026-11-13",
      "endDate": "2026-11-13",
      "location": "Quarterback Immobilien Arena Leipzig",
      "description": null,
      "image": "/fileadmin/files/_processed_/6/a/csm_tokio-hotel-arena-tour-tickets-eta-header_6b7bfb5ecb.jpg",
      "link": "https://www.quarterback-immobilien-arena.de/events-tickets/eventdetail/event/tokio-hotel/912",
      "tags": []
    },
    {
      "title": "Ina Müller und Band",
      "date": "Samstag, 14.11.2026",
      "startDate": "2026-11-14",
      "endDate": "2026-11-14",
      "location": "Quarterback Immobilien Arena Leipzig",
      "description": null,
      "image": "/fileadmin/files/_processed_/a/e/csm_Pressefoto_Ina_Mueller_und_Band_-_Die_6.0_Tour__C_Sandra_Ludewig-1x1_de1cdf65f6.png",
      "link": "https://www.quarterback-immobilien-arena.de/events-tickets/eventdetail/event/ina-mueller-und-band/951",
      "tags": []
    },
    {
      "title": "Berq",
      "date": "Dienstag, 17.11.2026",
      "startDate": "2026-11-17",
      "endDate": "2026-11-17",
      "location": "Quarterback Immobilien Arena Leipzig",
      "description": null,
      "image": "/fileadmin/files/_processed_/3/5/csm_Berg_-_Credit_Marla_Tabea_Ka__stle_01_c291324fc1.jpg",
      "link": "https://www.quarterback-immobilien-arena.de/events-tickets/eventdetail/event/berq/971",
      "tags": []
    },
    {
      "title": "Unheilig & Special Guests",
      "date": "Donnerstag, 19.11.2026",
      "startDate": "2026-11-19",
      "endDate": "2026-11-19",
      "location": "Quarterback Immobilien Arena Leipzig",
      "description": null,
      "image": "/fileadmin/files/_processed_/f/b/csm_instagram_1080x1080_8ce2bbd439.png",
      "link": "https://www.quarterback-immobilien-arena.de/events-tickets/eventdetail/event/unheilig-special-guests/997",
      "tags": []
    },
    {
      "title": "Unheilig & Special Guests",
      "date": "Freitag, 20.11.2026",
      "startDate": "2026-11-20",
      "endDate": "2026-11-20",
      "location": "Quarterback Immobilien Arena Leipzig",
      "description": null,
      "image": "/fileadmin/files/_processed_/f/b/csm_instagram_1080x1080_8ce2bbd439.png",
      "link": "https://www.quarterback-immobilien-arena.de/events-tickets/eventdetail/event/unheilig-special-guests/968",
      "tags": []
    },
    {
      "title": "Nights on Broadway",
      "date": "Freitag, 27.11.2026",
      "startDate": "2026-11-27",
      "endDate": "2026-11-27",
      "location": "Quarterback Immobilien Arena Leipzig",
      "description": null,
      "image": "/fileadmin/files/_processed_/f/2/csm_NOB_Online_2026_1080x1080_2323148b66.jpg",
      "link": "https://www.quarterback-immobilien-arena.de/events-tickets/eventdetail/event/nights-on-broadway-1/879",
      "tags": []
    },
    {
      "title": "Rea Garvey's Christmas Calling",
      "date": "Samstag, 28.11.2026",
      "startDate": "2026-11-28",
      "endDate": "2026-11-28",
      "location": "Quarterback Immobilien Arena Leipzig",
      "description": null,
      "image": "/fileadmin/files/_processed_/6/1/csm_Chistmas_Calling_2026_press_low_res_f6253325bd.jpg",
      "link": "https://www.quarterback-immobilien-arena.de/events-tickets/eventdetail/event/rea-garveys-christmas-calling/1004",
      "tags": []
    },
    {
      "title": "Chris Tall",
      "date": "Sonntag, 29.11.2026",
      "startDate": "2026-11-29",
      "endDate": "2026-11-29",
      "location": "Quarterback Immobilien Arena Leipzig",
      "description": null,
      "image": "/fileadmin/files/_processed_/f/d/csm_Pressefoto_CHRIS_TALL_Keep_Laughing_3__c__Robert_Maschke_74bb863844.jpg",
      "link": "https://www.quarterback-immobilien-arena.de/events-tickets/eventdetail/event/chris-tall/948",
      "tags": []
    },
    {
      "title": "Hazel Brugger",
      "date": "Mittwoch, 02.12.2026",
      "startDate": "2026-12-02",
      "endDate": "2026-12-02",
      "location": "Quarterback Immobilien Arena Leipzig",
      "description": null,
      "image": "/fileadmin/files/_processed_/f/8/csm_Pressegrafik_HAZEL_BRUGGER_Good_Evening_Europe__c__Viel_Spass_GmbH_klein_ed1420b47f.jpg",
      "link": "https://www.quarterback-immobilien-arena.de/events-tickets/eventdetail/event/hazel-brugger/981",
      "tags": []
    },
    {
      "title": "Lisa Eckhart",
      "date": "Donnerstag, 03.12.2026",
      "startDate": "2026-12-03",
      "endDate": "2026-12-03",
      "location": "Quarterback Immobilien Arena Leipzig",
      "description": null,
      "image": "/fileadmin/files/_processed_/0/6/csm_lisaeckhart_ich_war_mal_wer_plakatsujet_-c-jens-doerre_1__7f79796bba.jpg",
      "link": "https://www.quarterback-immobilien-arena.de/events-tickets/eventdetail/event/lisa-eckhart/931",
      "tags": []
    },
    {
      "title": "PUR",
      "date": "Freitag, 04.12.2026",
      "startDate": "2026-12-04",
      "endDate": "2026-12-04",
      "location": "Quarterback Immobilien Arena Leipzig",
      "description": null,
      "image": "/fileadmin/files/_processed_/4/5/csm_PUR_2026_SM_FB_INSTA_2440c5c1da.jpg",
      "link": "https://www.quarterback-immobilien-arena.de/events-tickets/eventdetail/event/pur/965",
      "tags": []
    },
    {
      "title": "Weimar",
      "date": "Samstag, 05.12.2026",
      "startDate": "2026-12-05",
      "endDate": "2026-12-05",
      "location": "Quarterback Immobilien Arena Leipzig",
      "description": null,
      "image": "/fileadmin/files/_processed_/5/3/csm_Tour_4x5_bebe01702c.jpg",
      "link": "https://www.quarterback-immobilien-arena.de/events-tickets/eventdetail/event/weimar/980",
      "tags": []
    },
    {
      "title": "BAP",
      "date": "Montag, 07.12.2026",
      "startDate": "2026-12-07",
      "endDate": "2026-12-07",
      "location": "Quarterback Immobilien Arena Leipzig",
      "description": null,
      "image": "/fileadmin/files/_processed_/0/7/csm_02_Pressefoto_BAP_DieZielgerade2026_WolfgangNiedecken_Fotocredit_TinaNiedecken_df133427b1.jpg",
      "link": "https://www.quarterback-immobilien-arena.de/events-tickets/eventdetail/event/bap/974",
      "tags": []
    },
    {
      "title": "Die Fantastischen Vier",
      "date": "Samstag, 16.01.2027",
      "startDate": "2027-01-16",
      "endDate": "2027-01-16",
      "location": "Quarterback Immobilien Arena Leipzig",
      "description": null,
      "image": "/fileadmin/files/_processed_/9/d/csm_03_DieFantastischenVier_DerLetzteBus_Credit_Mumpi_Kuenster_e908c88a4c.jpg",
      "link": "https://www.quarterback-immobilien-arena.de/events-tickets/eventdetail/event/die-fantastischen-vier/989",
      "tags": []
    },
    {
      "title": "Dieter Nuhr",
      "date": "Freitag, 22.01.2027",
      "startDate": "2027-01-22",
      "endDate": "2027-01-22",
      "location": "Quarterback Immobilien Arena Leipzig",
      "description": null,
      "image": "/fileadmin/files/_processed_/f/9/csm_2027_Nuhr_Bild1_aa79be6ee6.jpg",
      "link": "https://www.quarterback-immobilien-arena.de/events-tickets/eventdetail/event/dieter-nuhr/979",
      "tags": []
    },
    {
      "title": "Olaf Schubert und seine Freunde",
      "date": "Samstag, 23.01.2027",
      "startDate": "2027-01-23",
      "endDate": "2027-01-23",
      "location": "Quarterback Immobilien Arena Leipzig",
      "description": null,
      "image": "/fileadmin/files/_processed_/b/3/csm_2025-01-10_olaf-schubert-und-freunde-large__c_Amac_Garbe_4c700f308b.jpg",
      "link": "https://www.quarterback-immobilien-arena.de/events-tickets/eventdetail/event/olaf-schubert-und-seine-freunde/897",
      "tags": []
    },
    {
      "title": "Riverdance 30",
      "date": "Dienstag, 09.03.2027",
      "startDate": "2027-03-09",
      "endDate": "2027-03-09",
      "location": "Quarterback Immobilien Arena Leipzig",
      "description": null,
      "image": "/fileadmin/files/_processed_/4/7/csm_Riverdance__2__Photo_credit__c__Abhann_Productions_7b049ee0e5.jpg",
      "link": "https://www.quarterback-immobilien-arena.de/events-tickets/eventdetail/event/riverdance-30/991",
      "tags": []
    },
    {
      "title": "Pop Divas",
      "date": "Mittwoch, 17.03.2027",
      "startDate": "2027-03-17",
      "endDate": "2027-03-17",
      "location": "Quarterback Immobilien Arena Leipzig",
      "description": null,
      "image": "/fileadmin/files/_processed_/7/e/csm_2027_POP-DIVAS_Gruppenbild_credit_Holger-Fitchner_web_092f8ab97f.jpg",
      "link": "https://www.quarterback-immobilien-arena.de/events-tickets/eventdetail/event/pop-divas/985",
      "tags": []
    },
    {
      "title": "Michael Tsokos",
      "date": "Freitag, 19.03.2027",
      "startDate": "2027-03-19",
      "endDate": "2027-03-19",
      "location": "Quarterback Immobilien Arena Leipzig",
      "description": null,
      "image": "/fileadmin/files/_processed_/3/4/csm_2025-06-16_Tsokos_5823f11404.jpg",
      "link": "https://www.quarterback-immobilien-arena.de/events-tickets/eventdetail/event/michael-tsokos/949",
      "tags": []
    },
    {
      "title": "Maite Kelly",
      "date": "Samstag, 20.03.2027",
      "startDate": "2027-03-20",
      "endDate": "2027-03-20",
      "location": "Quarterback Immobilien Arena Leipzig",
      "description": null,
      "image": "/fileadmin/files/_processed_/8/c/csm_Maite_Kelly_klein_f7746a937f.jpg",
      "link": "https://www.quarterback-immobilien-arena.de/events-tickets/eventdetail/event/maite-kelly/977",
      "tags": []
    },
    {
      "title": "Tahnee",
      "date": "Samstag, 03.04.2027",
      "startDate": "2027-04-03",
      "endDate": "2027-04-03",
      "location": "Quarterback Immobilien Arena Leipzig",
      "description": null,
      "image": "/fileadmin/files/_processed_/6/d/csm_Pressefoto_TAHNEE_BLUETEZEIT_2__c__Andra_70d16a1d3a.jpg",
      "link": "https://www.quarterback-immobilien-arena.de/events-tickets/eventdetail/event/tahnee/894",
      "tags": []
    },
    {
      "title": "LEA",
      "date": "Samstag, 01.05.2027",
      "startDate": "2027-05-01",
      "endDate": "2027-05-01",
      "location": "Quarterback Immobilien Arena Leipzig",
      "description": null,
      "image": "/fileadmin/files/_processed_/2/c/csm_2025-10-13_Pressefoto_af53a5e55d.jpg",
      "link": "https://www.quarterback-immobilien-arena.de/events-tickets/eventdetail/event/lea/976",
      "tags": []
    },
    {
      "title": "Herbert Grönemeyer",
      "date": "Samstag, 12.06.2027",
      "startDate": "2027-06-12",
      "endDate": "2027-06-12",
      "location": "Quarterback Immobilien Arena Leipzig",
      "description": null,
      "image": "/fileadmin/files/_processed_/8/e/csm_Herbert_Groenemeyer_1_credits_Erik_Weiss_klein_a1d475a1a3.jpg",
      "link": "https://www.quarterback-immobilien-arena.de/events-tickets/eventdetail/event/herbert-groenemeyer/1006",
      "tags": []
    },
    {
      "title": "Die Toten Hosen",
      "date": "Samstag, 26.06.2027",
      "startDate": "2027-06-26",
      "endDate": "2027-06-26",
      "location": "Quarterback Immobilien Arena Leipzig",
      "description": null,
      "image": "/fileadmin/files/_processed_/5/d/csm_02_2025-pressefoto-dth-credit-robert-eikelpoth-01_e69328977e.jpg",
      "link": "https://www.quarterback-immobilien-arena.de/events-tickets/eventdetail/event/die-toten-hosen/993",
      "tags": []
    },
    {
      "title": "Johann König",
      "date": "Samstag, 02.10.2027",
      "startDate": "2027-10-02",
      "endDate": "2027-10-02",
      "location": "Quarterback Immobilien Arena Leipzig",
      "description": null,
      "image": "/fileadmin/files/_processed_/5/f/csm_Pressefoto_JOHANN_KOENIG_Heute_ein_Koenig_3__c__Marcus_Mueller_Saran_270806ff92.jpg",
      "link": "https://www.quarterback-immobilien-arena.de/events-tickets/eventdetail/event/johann-koenig/992",
      "tags": []
    },
    {
      "title": "Andrea Berg",
      "date": "Donnerstag, 14.10.2027",
      "startDate": "2027-10-14",
      "endDate": "2027-10-14",
      "location": "Quarterback Immobilien Arena Leipzig",
      "description": null,
      "image": "/fileadmin/files/_processed_/4/3/csm_01_Pressefoto_AndreaBergLive2027_NadineVolz_8a54cadba5.jpg",
      "link": "https://www.quarterback-immobilien-arena.de/events-tickets/eventdetail/event/andrea-berg/975",
      "tags": []
    },
    {
      "title": "Torsten Sträter",
      "date": "Samstag, 30.10.2027",
      "startDate": "2027-10-30",
      "endDate": "2027-10-30",
      "location": "Quarterback Immobilien Arena Leipzig",
      "description": null,
      "image": "/fileadmin/files/_processed_/4/c/csm_straeter-large_f4c88bbfc0.jpg",
      "link": "https://www.quarterback-immobilien-arena.de/events-tickets/eventdetail/event/torsten-straeter/988",
      "tags": []
    },
    {
      "title": "Ralf Schmitz",
      "date": "Donnerstag, 25.11.2027",
      "startDate": "2027-11-25",
      "endDate": "2027-11-25",
      "location": "Quarterback Immobilien Arena Leipzig",
      "description": null,
      "image": "/fileadmin/files/_processed_/5/d/csm_Pressegrafik_RALF_SCHMITZ_Schmitzmaen__c__HPR_Kuenstler___Medien_GmbH_klein_3e77e6b13e.jpg",
      "link": "https://www.quarterback-immobilien-arena.de/events-tickets/eventdetail/event/ralf-schmitz-1/1005",
      "tags": []
    },
    {
      "title": "Martin Rütter",
      "date": "Samstag, 11.03.2028",
      "startDate": "2028-03-11",
      "endDate": "2028-03-11",
      "location": "Quarterback Immobilien Arena Leipzig",
      "description": null,
      "image": "/fileadmin/files/_processed_/4/3/csm_2028-03-11_Martin_Ruetter_b00cbf1df0.jpg",
      "link": "https://www.quarterback-immobilien-arena.de/events-tickets/eventdetail/event/martin-ruetter/990",
      "tags": []
    }
  ]
}